{
  "placements": [
    {
      "finish_id": "F01",
      "placement_id": "P001",
      "rotation_deg": 0,
      "sku": "NW-COL-003",
      "x_mm": 1600,
      "y_mm": 600
    },
    {
      "finish_id": "F01",
      "placement_id": "P002",
      "rotation_deg": 0,
      "sku": "NW-COL-003",
      "x_mm": 3600,
      "y_mm": 600
    },
    {
      "finish_id": "F02",
      "placement_id": "P003",
      "rotation_deg": 0,
      "sku": "NW-CHA-001",
      "x_mm": 5600,
      "y_mm": 600
    },
    {
      "finish_id": "F02",
      "placement_id": "P004",
      "rotation_deg": 180,
      "sku": "NW-CHA-001",
      "x_mm": 600,
      "y_mm": 5500
    },
    {
      "finish_id": "F02",
      "placement_id": "P005",
      "rotation_deg": 0,
      "sku": "NW-CHA-001",
      "x_mm": 8400,
      "y_mm": 4200
    },
    {
      "finish_id": "F02",
      "placement_id": "P006",
      "rotation_deg": 0,
      "sku": "NW-CHA-001",
      "x_mm": 3800,
      "y_mm": 4200
    },
    {
      "finish_id": "F02",
      "placement_id": "P007",
      "rotation_deg": 0,
      "sku": "NW-CHA-001",
      "x_mm": 2600,
      "y_mm": 1300
    },
    {
      "finish_id": "F02",
      "placement_id": "P008",
      "rotation_deg": 180,
      "sku": "NW-CHA-001",
      "x_mm": 6100,
      "y_mm": 5500
    },
    {
      "finish_id": "F02",
      "placement_id": "P009",
      "rotation_deg": 0,
      "sku": "NW-CHA-001",
      "x_mm": 8300,
      "y_mm": 1000
    },
    {
      "finish_id": "F02",
      "placement_id": "P010",
      "rotation_deg": 0,
      "sku": "NW-CHA-001",
      "x_mm": 6800,
      "y_mm": 2600
    },
    {
      "finish_id": "F02",
      "placement_id": "P011",
      "rotation_deg": 0,
      "sku": "NW-CHA-001",
      "x_mm": 700,
      "y_mm": 2600
    },
    {
      "finish_id": "F02",
      "placement_id": "P012",
      "rotation_deg": 0,
      "sku": "NW-CHA-001",
      "x_mm": 4500,
      "y_mm": 2200
    },
    {
      "finish_id": "F02",
      "placement_id": "P013",
      "rotation_deg": 0,
      "sku": "NW-CHA-001",
      "x_mm": 2200,
      "y_mm": 3400
    },
    {
      "finish_id": "F02",
      "placement_id": "P014",
      "rotation_deg": 0,
      "sku": "NW-CHA-001",
      "x_mm": 5100,
      "y_mm": 2300
    },
    {
      "finish_id": "F02",
      "placement_id": "P015",
      "rotation_deg": 180,
      "sku": "NW-CHA-001",
      "x_mm": 2600,
      "y_mm": 5300
    },
    {
      "finish_id": "F02",
      "placement_id": "P016",
      "rotation_deg": 0,
      "sku": "NW-CHA-001",
      "x_mm": 1200,
      "y_mm": 4300
    },
    {
      "finish_id": "F02",
      "placement_id": "P017",
      "rotation_deg": 0,
      "sku": "NW-CHA-001",
      "x_mm": 5000,
      "y_mm": 4800
    },
    {
      "finish_id": "F02",
      "placement_id": "P018",
      "rotation_deg": 0,
      "sku": "NW-CHA-001",
      "x_mm": 6200,
      "y_mm": 1600
    },
    {
      "finish_id": "F01",
      "placement_id": "P019",
      "rotation_deg": 0,
      "sku": "NW-STO-001",
      "x_mm": 4100,
      "y_mm": 5700
    },
    {
      "finish_id": "F01",
      "placement_id": "P020",
      "rotation_deg": 0,
      "sku": "NW-STO-001",
      "x_mm": 7200,
      "y_mm": 600
    },
    {
      "finish_id": "F01",
      "placement_id": "P021",
      "rotation_deg": 0,
      "sku": "NW-STO-001",
      "x_mm": 7600,
      "y_mm": 3400
    },
    {
      "finish_id": "F01",
      "placement_id": "P022",
      "rotation_deg": 0,
      "sku": "NW-STO-001",
      "x_mm": 7400,
      "y_mm": 3800
    }
  ],
  "room_id": "ROOM-02",
  "status": "unsatisfiable",
  "violations": [
    {
      "affected_placement_ids": [
        "P012",
        "P014"
      ],
      "measured": {
        "achieved_collaboration_units": 2,
        "achieved_seating_capacity": 16,
        "achieved_storage_units": 4,
        "achieved_workstation_capacity": 0,
        "termination_reason": "local_repair_exhausted",
        "unresolved_spatial_violations": 2,
        "walkway_gap_mm": 80
      },
      "message": "Primary walkways require 900 mm clear width.",
      "repair_options": [
        {
          "action": "human_escalation",
          "trade_off": "Unresolvable room requirements: achieved 16/16 seats, 0/0 workstations with 2 unresolved spatial violations."
        }
      ],
      "required": {
        "min_walkway_gap_mm": 900,
        "required_collaboration_units": 2,
        "required_seating_capacity": 16,
        "required_storage_units": 4,
        "required_workstation_capacity": 0
      },
      "rule_id": "RB-GEO-001",
      "violation_id": "V001"
    },
    {
      "affected_placement_ids": [
        "P005"
      ],
      "measured": {
        "achieved_collaboration_units": 2,
        "achieved_seating_capacity": 16,
        "achieved_storage_units": 4,
        "achieved_workstation_capacity": 0,
        "termination_reason": "local_repair_exhausted",
        "unresolved_spatial_violations": 2,
        "wall_offset_mm": 80
      },
      "message": "Furniture must remain at least 100 mm from a wall unless wall-mounted.",
      "repair_options": [
        {
          "action": "human_escalation",
          "trade_off": "Unresolvable room requirements: achieved 16/16 seats, 0/0 workstations with 2 unresolved spatial violations."
        }
      ],
      "required": {
        "min_wall_offset_mm": 100,
        "required_collaboration_units": 2,
        "required_seating_capacity": 16,
        "required_storage_units": 4,
        "required_workstation_capacity": 0
      },
      "rule_id": "RB-GEO-005",
      "violation_id": "V002"
    }
  ]
}
