{
  "placements": [
    {
      "finish_id": "F01",
      "placement_id": "P001",
      "rotation_deg": 0,
      "sku": "NW-DES-001",
      "x_mm": 8300,
      "y_mm": 300
    },
    {
      "finish_id": "F02",
      "placement_id": "P002",
      "rotation_deg": 0,
      "sku": "NW-CHA-001",
      "x_mm": 8600,
      "y_mm": 1800
    },
    {
      "finish_id": "F01",
      "placement_id": "P003",
      "rotation_deg": 0,
      "sku": "NW-DES-001",
      "x_mm": 2000,
      "y_mm": 300
    },
    {
      "finish_id": "F02",
      "placement_id": "P004",
      "rotation_deg": 0,
      "sku": "NW-CHA-001",
      "x_mm": 2300,
      "y_mm": 1800
    },
    {
      "finish_id": "F01",
      "placement_id": "P005",
      "rotation_deg": 0,
      "sku": "NW-DES-001",
      "x_mm": 3200,
      "y_mm": 300
    },
    {
      "finish_id": "F02",
      "placement_id": "P006",
      "rotation_deg": 90,
      "sku": "NW-CHA-001",
      "x_mm": 5400,
      "y_mm": 3600
    },
    {
      "finish_id": "F01",
      "placement_id": "P007",
      "rotation_deg": 0,
      "sku": "NW-DES-001",
      "x_mm": 4400,
      "y_mm": 300
    },
    {
      "finish_id": "F02",
      "placement_id": "P008",
      "rotation_deg": 0,
      "sku": "NW-CHA-001",
      "x_mm": 6100,
      "y_mm": 600
    },
    {
      "finish_id": "F01",
      "placement_id": "P009",
      "rotation_deg": 270,
      "sku": "NW-DES-001",
      "x_mm": 6700,
      "y_mm": 300
    },
    {
      "finish_id": "F02",
      "placement_id": "P010",
      "rotation_deg": 0,
      "sku": "NW-CHA-001",
      "x_mm": 600,
      "y_mm": 3500
    },
    {
      "finish_id": "F01",
      "placement_id": "P011",
      "rotation_deg": 0,
      "sku": "NW-DES-001",
      "x_mm": 600,
      "y_mm": 1100
    },
    {
      "finish_id": "F01",
      "placement_id": "P012",
      "rotation_deg": 0,
      "sku": "NW-DES-001",
      "x_mm": 4100,
      "y_mm": 2400
    },
    {
      "finish_id": "F01",
      "placement_id": "P013",
      "rotation_deg": 0,
      "sku": "NW-DES-001",
      "x_mm": 2900,
      "y_mm": 2700
    },
    {
      "finish_id": "F01",
      "placement_id": "P014",
      "rotation_deg": 270,
      "sku": "NW-DES-001",
      "x_mm": 1300,
      "y_mm": 2600
    },
    {
      "finish_id": "F02",
      "placement_id": "P015",
      "rotation_deg": 180,
      "sku": "NW-CHA-001",
      "x_mm": 7700,
      "y_mm": 3500
    },
    {
      "finish_id": "F02",
      "placement_id": "P016",
      "rotation_deg": 0,
      "sku": "NW-CHA-001",
      "x_mm": 9500,
      "y_mm": 600
    },
    {
      "finish_id": "F02",
      "placement_id": "P017",
      "rotation_deg": 180,
      "sku": "NW-CHA-001",
      "x_mm": 6300,
      "y_mm": 3000
    },
    {
      "finish_id": "F02",
      "placement_id": "P018",
      "rotation_deg": 180,
      "sku": "NW-CHA-001",
      "x_mm": 3500,
      "y_mm": 2100
    },
    {
      "finish_id": "F02",
      "placement_id": "P019",
      "rotation_deg": 0,
      "sku": "NW-CHA-001",
      "x_mm": 9500,
      "y_mm": 2200
    },
    {
      "finish_id": "F02",
      "placement_id": "P020",
      "rotation_deg": 180,
      "sku": "NW-CHA-001",
      "x_mm": 700,
      "y_mm": 2600
    },
    {
      "finish_id": "F02",
      "placement_id": "P021",
      "rotation_deg": 180,
      "sku": "NW-CHA-001",
      "x_mm": 6900,
      "y_mm": 3500
    },
    {
      "finish_id": "F02",
      "placement_id": "P022",
      "rotation_deg": 180,
      "sku": "NW-CHA-001",
      "x_mm": 5300,
      "y_mm": 2600
    },
    {
      "finish_id": "F02",
      "placement_id": "P023",
      "rotation_deg": 90,
      "sku": "NW-CHA-001",
      "x_mm": 9500,
      "y_mm": 1200
    },
    {
      "finish_id": "F01",
      "placement_id": "P024",
      "rotation_deg": 0,
      "sku": "NW-STO-001",
      "x_mm": 5500,
      "y_mm": 3200
    },
    {
      "finish_id": "F01",
      "placement_id": "P025",
      "rotation_deg": 0,
      "sku": "NW-STO-001",
      "x_mm": 6100,
      "y_mm": 3600
    }
  ],
  "room_id": "ROOM-04",
  "status": "unsatisfiable",
  "violations": [
    {
      "affected_placement_ids": [
        "P003"
      ],
      "measured": {
        "achieved_seating_capacity": 14,
        "achieved_storage_units": 2,
        "achieved_workstation_capacity": 9,
        "egress_clearance_mm": 550,
        "termination_reason": "local_repair_exhausted",
        "unresolved_spatial_violations": 6
      },
      "message": "The marked egress path requires 1100 mm clear width.",
      "repair_options": [
        {
          "action": "human_escalation",
          "trade_off": "Unresolvable room requirements: achieved 14/14 seats, 9/14 workstations with 6 unresolved spatial violations."
        }
      ],
      "required": {
        "min_egress_width_mm": 1100,
        "required_seating_capacity": 14,
        "required_storage_units": 2,
        "required_workstation_capacity": 14
      },
      "rule_id": "RB-GEO-002",
      "violation_id": "V001"
    },
    {
      "affected_placement_ids": [
        "P005"
      ],
      "measured": {
        "achieved_seating_capacity": 14,
        "achieved_storage_units": 2,
        "achieved_workstation_capacity": 9,
        "egress_clearance_mm": 550,
        "termination_reason": "local_repair_exhausted",
        "unresolved_spatial_violations": 6
      },
      "message": "The marked egress path requires 1100 mm clear width.",
      "repair_options": [
        {
          "action": "human_escalation",
          "trade_off": "Unresolvable room requirements: achieved 14/14 seats, 9/14 workstations with 6 unresolved spatial violations."
        }
      ],
      "required": {
        "min_egress_width_mm": 1100,
        "required_seating_capacity": 14,
        "required_storage_units": 2,
        "required_workstation_capacity": 14
      },
      "rule_id": "RB-GEO-002",
      "violation_id": "V002"
    },
    {
      "affected_placement_ids": [
        "P007"
      ],
      "measured": {
        "achieved_seating_capacity": 14,
        "achieved_storage_units": 2,
        "achieved_workstation_capacity": 9,
        "egress_clearance_mm": 550,
        "termination_reason": "local_repair_exhausted",
        "unresolved_spatial_violations": 6
      },
      "message": "The marked egress path requires 1100 mm clear width.",
      "repair_options": [
        {
          "action": "human_escalation",
          "trade_off": "Unresolvable room requirements: achieved 14/14 seats, 9/14 workstations with 6 unresolved spatial violations."
        }
      ],
      "required": {
        "min_egress_width_mm": 1100,
        "required_seating_capacity": 14,
        "required_storage_units": 2,
        "required_workstation_capacity": 14
      },
      "rule_id": "RB-GEO-002",
      "violation_id": "V003"
    },
    {
      "affected_placement_ids": [
        "P006"
      ],
      "measured": {
        "achieved_seating_capacity": 14,
        "achieved_storage_units": 2,
        "achieved_workstation_capacity": 9,
        "termination_reason": "local_repair_exhausted",
        "unresolved_spatial_violations": 6,
        "wall_offset_mm": 80
      },
      "message": "Furniture must remain at least 100 mm from a wall unless wall-mounted.",
      "repair_options": [
        {
          "action": "human_escalation",
          "trade_off": "Unresolvable room requirements: achieved 14/14 seats, 9/14 workstations with 6 unresolved spatial violations."
        }
      ],
      "required": {
        "min_wall_offset_mm": 100,
        "required_seating_capacity": 14,
        "required_storage_units": 2,
        "required_workstation_capacity": 14
      },
      "rule_id": "RB-GEO-005",
      "violation_id": "V004"
    },
    {
      "affected_placement_ids": [
        "P010"
      ],
      "measured": {
        "achieved_seating_capacity": 14,
        "achieved_storage_units": 2,
        "achieved_workstation_capacity": 9,
        "pull_out_zone_mm": 0,
        "termination_reason": "local_repair_exhausted",
        "unresolved_spatial_violations": 6
      },
      "message": "Task chairs require a 750 mm pull-out zone.",
      "repair_options": [
        {
          "action": "human_escalation",
          "trade_off": "Unresolvable room requirements: achieved 14/14 seats, 9/14 workstations with 6 unresolved spatial violations."
        }
      ],
      "required": {
        "pull_out_zone_mm": 750,
        "required_seating_capacity": 14,
        "required_storage_units": 2,
        "required_workstation_capacity": 14
      },
      "rule_id": "RB-GEO-008",
      "violation_id": "V005"
    },
    {
      "affected_placement_ids": [
        "P016"
      ],
      "measured": {
        "achieved_seating_capacity": 14,
        "achieved_storage_units": 2,
        "achieved_workstation_capacity": 9,
        "pull_out_zone_mm": 0,
        "termination_reason": "local_repair_exhausted",
        "unresolved_spatial_violations": 6
      },
      "message": "Task chairs require a 750 mm pull-out zone.",
      "repair_options": [
        {
          "action": "human_escalation",
          "trade_off": "Unresolvable room requirements: achieved 14/14 seats, 9/14 workstations with 6 unresolved spatial violations."
        }
      ],
      "required": {
        "pull_out_zone_mm": 750,
        "required_seating_capacity": 14,
        "required_storage_units": 2,
        "required_workstation_capacity": 14
      },
      "rule_id": "RB-GEO-008",
      "violation_id": "V006"
    }
  ]
}
